Write the command executed for the capture

I wrote this same command but showing 10 and it doesnt not load them for some reason.

root@lamp-ubuntu-s-1vcpu-1gb-intel-tor1-01:~# tcpdump -c 5 -i eth0 udp


tcpdump: verbose output suppressed, use -v or -vv for full protocol decode
listening on eth0, link-type EN10MB (Ethernet), capture size 262144 bytes
16:33:00.695638 IP 2.57.122.35.37989 > lamp-ubuntu-s-1vcpu-1gb-intel-tor1-01.17: UDP, length 0
16:33:00.696438 IP lamp-ubuntu-s-1vcpu-1gb-intel-tor1-01.46701 > 67.207.67.2.domain: 29207+ [1au] PTR? 26.47.198.143.in-addr.arpa. (55)
16:33:00.696480 IP lamp-ubuntu-s-1vcpu-1gb-intel-tor1-01.43598 > 67.207.67.2.domain: 42055+ [1au] PTR? 26.47.198.143.in-addr.arpa. (55)
16:33:00.696519 IP lamp-ubuntu-s-1vcpu-1gb-intel-tor1-01.43456 > 67.207.67.2.domain: 54233+ [1au] PTR? 26.47.198.143.in-addr.arpa. (55)
16:33:00.697208 IP 67.207.67.2.domain > lamp-ubuntu-s-1vcpu-1gb-intel-tor1-01.43598: 42055 NXDomain 0/1/1 (122)

